{
  "status": "approved",
  "approvedAt": "2026-07-23T00:00:00.000Z",
  "product": {
    "name": "괌 두짓타니 4박 5일 가족여행",
    "category": "금까기",
    "layout": "hotel-sales",
    "destination": "괌",
    "subtitle": "가족 맞춤 휴양 4박 5일"
  },
  "common": {
    "categoryLabel": "GUAM FAMILY",
    "title": "두짓타니 괌 4박 5일",
    "body": "가족 맞춤 휴양 상품입니다."
  },
  "blockOrder": ["text", "image", "list", "table"],
  "blocks": [
    { "type": "text" },
    { "type": "image", "mediaIds": ["hotel-exterior"] },
    { "type": "list", "items": ["두짓타니 괌 4박", "조식 및 공항 왕복 이동"] },
    {
      "type": "table",
      "tableHeaders": ["구분", "내용"],
      "tableRows": [["항공편", "출발일별 확인 필요"]]
    }
  ],
  "confirmedFacts": [
    { "field": "숙박", "value": "두짓타니 괌 4박", "source": "사용자 제공 일정표", "status": "confirmed" }
  ],
  "needsReview": [
    { "field": "항공편", "value": "출발일별 확인 필요", "source": "사용자 제공 원문", "status": "needs-review" }
  ],
  "imageDirections": [
    { "imageId": "hotel-exterior", "role": "hero", "selected": true }
  ],
  "images": [
    {
      "id": "hotel-exterior",
      "name": "dusit-thani-guam.jpg",
      "src": "https://example.com/dusit-thani-guam.jpg",
      "alt": "두짓타니 괌 리조트 외관",
      "downloadStatus": "pending"
    }
  ]
}
